{"cassette":{"id":"CASSETTE-REPLAY-0001","interactions":[{"correlation_id":"CORRELATION-0001","events":[{"correlation_id":"CORRELATION-0001","delivery":"not-applicable","fault":null,"frame_sha256":null,"sequence":1,"type":"request-accepted","virtual_ms":0},{"correlation_id":"CORRELATION-0001","delivery":"certain","fault":null,"frame_sha256":"eeeeeeeeeeeeeeeeeeeeeeeeeeeeeeeeeeeeeeeeeeeeeeeeeeeeeeeeeeeeeeee","sequence":2,"type":"response-frame","virtual_ms":10},{"correlation_id":"CORRELATION-0001","delivery":"uncertain","fault":{"kind":"connection-reset","seed":7},"frame_sha256":null,"sequence":3,"type":"fault","virtual_ms":20}],"id":"INTERACTION-0001","request":{"body_sha256":"bbbbbbbbbbbbbbbbbbbbbbbbbbbbbbbbbbbbbbbbbbbbbbbbbbbbbbbbbbbbbbbb","headers":[{"name":"content-type","value_sha256":"aaaaaaaaaaaaaaaaaaaaaaaaaaaaaaaaaaaaaaaaaaaaaaaaaaaaaaaaaaaaaaaa"}],"match_sha256":"eab4134b31ad189e25b87e5d70997d5975d8d1197970f35598465edd0b40e65f","method":"POST","route_id":"chat-completions"},"retry":{"idempotency_proof_sha256":null,"mode":"none","retry_of":null}}],"limits":{"max_bytes":20000,"max_events":16,"max_frames":4,"max_headers":4,"max_interactions":4,"max_retries":2,"max_virtual_ms":1000},"normalization":{"body":"sha256-only","headers":"lowercase-sorted","method":"uppercase","query":"canonical-sorted"},"redaction":{"rules_sha256":"1111111111111111111111111111111111111111111111111111111111111111","stage":"pre-serialization","version":"awq-redaction-v1"}},"classification":"synthetic-replay","consumption":{"events":3,"frames":1,"interactions":1,"retries":0,"unconsumed_frames":0},"kind":"agent-runtime-replay","launch":{"adapter":{"id":"ADAPTER-SYNTHETIC","version":"1.0.0"},"adapter_set":{"preserved":["max-tokens","temperature"],"requested":["max-tokens","temperature"],"unsupported":[]},"argv":{"count":3,"sha256":"7777777777777777777777777777777777777777777777777777777777777777"},"credential_resolver":{"config_sha256":"abababababababababababababababababababababababababababababababab","id":"RESOLVER-SYNTHETIC"},"environment":{"names":["lang","lc-all"],"sha256":"8888888888888888888888888888888888888888888888888888888888888888"},"model":{"id":"MODEL-SYNTHETIC","settings_sha256":"2222222222222222222222222222222222222222222222222222222222222222"},"network":{"endpoint_count":0,"mode":"replay-only"},"prompt_transport":{"content_sha256":"9999999999999999999999999999999999999999999999999999999999999999","mode":"digest-only"},"provider":{"endpoint_class":"loopback-replay","id":"PROVIDER-SYNTHETIC"},"run":{"attempt":1,"id":"RUN-SYNTHETIC-0001"},"runtime":{"executable_sha256":"3333333333333333333333333333333333333333333333333333333333333333","name":"python","version":"3.12.14"},"source":{"commit":"5555555555555555555555555555555555555555","tree":"6666666666666666666666666666666666666666"},"telemetry":{"mode":"disabled"},"workload":{"id":"WORKLOAD-SYNTHETIC","sha256":"4444444444444444444444444444444444444444444444444444444444444444"}},"limitations":["Synthetic replay does not establish live provider compatibility or model quality.","Digest commitments do not retain prompts, responses, credentials, or subprocess output.","Consumer-native gates and live environmental observations remain independently required."],"non_claims":["live-provider-compatibility","model-quality","provider-equivalence","sandbox-containment"],"schema_version":1}
